attrs : 
{
    bcdUSB = 0x200;
    bDeviceClass = 0x0;
    bDeviceSubClass = 0x0;
    bDeviceProtocol = 0x0;
    bMaxPacketSize0 = 0x40;
    idVendor = 0x1D6B;
    idProduct = 0x104;
    bcdDevice = 0x404;
};
os_descs : 
{
    use = 0;
    qw_sign = "";
    b_vendor_code = 0x0;
};
strings = ( 
    {
        lang = 0x409;
        manufacturer = "BeagleBoard.org";
        product = "BeagleBoneBlack";
        serialnumber = "BBBSERIALNUM";
    } );
functions : 
{
    acm_usb0 : 
    {
        instance = "usb0";
        type = "acm";
        attrs : 
        {
        };
        os_descs = ( );
    };
};
configs = ( 
    {
        id = 1;
        name = "c";
        attrs : 
        {
            bmAttributes = 0x80;
            bMaxPower = 0xF4;
        };
        strings = ( 
            {
                lang = 0x409;
                configuration = "BeagleBone Composite";
            } );
        functions = ( 
            {
                name = "acm.usb0";
                function = "acm_usb0";
            } );
    } );
