attrs : 
{
    bcdUSB = 0x200;
    bDeviceClass = 0x0;
    bDeviceSubClass = 0x0;
    bDeviceProtocol = 0x0;
    bMaxPacketSize0 = 0x40;
    idVendor = 0x1D6B;
    idProduct = 0x104;
    bcdDevice = 0x404;
};
os_descs : 
{
    config_id = 1;
    use = 1;
    qw_sign = "MSFT100";
    b_vendor_code = 0x0;
};
strings = ( 
    {
        lang = 0x409;
        manufacturer = "BeagleBoard.org";
        product = "BeagleBoneBlack";
        serialnumber = "BBBSERIALNUM";
    } );
functions : 
{
    acm_usb0 : 
    {
        instance = "usb0";
        type = "acm";
        attrs : 
        {
        };
        os_descs = ( );
    };
    mass_storage_usb0 : 
    {
        instance = "usb0";
        type = "mass_storage";
        attrs : 
        {
            stall = false;
            luns = ( 
                {
                    cdrom = false;
                    ro = true;
                    nofua = true;
                    removable = true;
                    file = "MASS_STORAGE.IMG";
                } );
        };
        os_descs = ( );
    };
    ncm_usb0 : 
    {
        instance = "usb0";
        type = "ncm";
        attrs : 
        {
            dev_addr = "NCM_DEV_ADDR";
            host_addr = "NCM_HOST_ADDR";
            qmult = 5;
        };
        os_descs = ( );
    };
    rndis_usb0 : 
    {
        instance = "usb0";
        type = "rndis";
        attrs : 
        {
            dev_addr = "RNDIS_DEV_ADDR";
            host_addr = "RNDIS_HOST_ADDR";
            qmult = 5;
        };
        os_descs = ( 
            {
                interface = "rndis";
                compatible_id = "RNDIS";
                sub_compatible_id = "5162001";
            } );
    };
};
configs = ( 
    {
        id = 1;
        name = "c";
        attrs : 
        {
            bmAttributes = 0x80;
            bMaxPower = 0xF4;
        };
        strings = ( 
            {
                lang = 0x409;
                configuration = "BeagleBone Composite";
            } );
        functions = ( 
            {
                name = "acm.usb0";
                function = "acm_usb0";
            }, 
            {
                name = "mass_storage.usb0";
                function = "mass_storage_usb0";
            }, 
            {
                name = "ncm.usb0";
                function = "ncm_usb0";
            }, 
            {
                name = "rndis.usb0";
                function = "rndis_usb0";
            } );
    } );
