attrs : 
{
    bcdUSB = 0x200;
    bDeviceClass = 0x0;
    bDeviceSubClass = 0x0;
    bDeviceProtocol = 0x0;
    bMaxPacketSize0 = 0x40;
    idVendor = 0x1D6B;
    idProduct = 0x104;
    bcdDevice = 0x404;
};
os_descs : 
{
    config_id = 1;
    use = 1;
    qw_sign = "MSFT100";
    b_vendor_code = 0x0;
};
strings = ( 
    {
        lang = 0x409;
        manufacturer = "BeagleBoard.org";
        product = "BeagleBoneBlack";
        serialnumber = "BBBSERIALNUM";
    } );
functions : 
{
    ncm_usb0 : 
    {
        instance = "usb0";
        type = "ncm";
        attrs : 
        {
            qmult = 5;
        };
        os_descs = ( );
    };
    rndis_usb0 : 
    {
        instance = "usb0";
        type = "rndis";
        attrs : 
        {
            qmult = 5;
        };
        os_descs = ( 
            {
                interface = "rndis";
                compatible_id = "RNDIS";
                sub_compatible_id = "5162001";
            } );
    };
};
configs = ( 
    {
        id = 1;
        name = "c";
        attrs : 
        {
            bmAttributes = 0x80;
            bMaxPower = 0xF4;
        };
        strings = ( 
            {
                lang = 0x409;
                configuration = "BeagleBone Composite";
            } );
        functions = ( 
            {
                name = "ncm.usb0";
                function = "ncm_usb0";
            }, 
            {
                name = "rndis.usb0";
                function = "rndis_usb0";
            } );
    } );
